user_input,retrieved_contexts,response,faithfulness,answer_relevancy
What are some of Brazil’s major exports?,"[""emerging,[23][24] upper-middle income economy and newly industrialized country,[25] with one of the 10 largest economies in the world in both nominal and PPP terms,[7][26] the largest economy in Latin America and the Southern Hemisphere, and the largest share of wealth in South America. With a complex and highly diversified economy, Brazil is one of the world's major or primary exporters of various agricultural goods, mineral resources, and manufactured products.[27] Due to its rich culture and history, the"", ""beef, chicken meat, soybean meal, sugar, coffee, tobacco, cotton, orange juice, footwear, airplanes, cars, vehicle parts, gold, ethanol and semi-finished iron, among other products.[282][283]\n\nBrazil is the world's 24th-largest exporter and 26th-largest importer as of 2021[update].[284][285] China is its largest trading partner, accounting for 32% of the total trade. Other large trading partners include the United States, Argentina, the Netherlands and Canada.[286] Its automotive industry is the"", ""meat, beef, pork and cow's milk in the world.[277] In the mining sector, Brazil is among the largest producers of iron ore, copper, gold,[278] bauxite, manganese, tin, niobium,[279] and nickel. In terms of precious stones, Brazil is the world's largest producer of amethyst, topaz, agate and one of the main producers of tourmaline, emerald, aquamarine, garnet and opal.[280][281] The country is a major exporter of soy, iron ore, pulp (cellulose), maize, beef, chicken meat, soybean meal, sugar, coffee,""]"," Based on the provided context, some of Brazil's major exports include various agricultural goods such as beef, chicken meat, soybean meal, sugar, coffee, tobacco, cotton, and orange juice. Additionally, mineral resources like gold, iron ore, copper, bauxite, manganese, tin, niobium, nickel, amethyst, topaz, agate, tourmaline, emerald, aquamarine, garnet, and opal are significant exports. Manufactured products, including footwear, airplanes, cars, vehicle parts, electronics, and pulp (cellulose) also play a crucial role in Brazil's export portfolio. As of 2021, Brazil is the world's 24th-largest exporter and 26th-largest importer, with China being its largest trading partner (accounting for 32% of total trade). Other significant trading partners include the United States, Argentina, the Netherlands, and Canada. The automotive industry is also a key sector in Brazil's economy.",1.0,0.9993353963650522
What is the dominant religion in Brazil?,"['the population followed Roman Catholicism; 22.2% Protestantism; 2.0% Kardecist spiritism; 3.2% other religions, undeclared or undetermined; while 8.0% had no religion.[406] In 2019, it was estimated that 50% were Roman Catholic; 31% Protestant; 11% irreligious; 3% Spiritist; 2% practitioners of Afro-Brazilian faiths; and 0.3% Jewish.[407]\n\nReligious diversity in Brazil developed from the meeting of the Roman Catholic Church with the religious traditions of enslaved African peoples and indigenous', ""Catholic Church in Brazil and Protestantism in Brazil\n\nReligion in Brazil (2010 Census)\n\nCatholicism (64.6%)\n\nProtestantism (22.2%)\n\nSpiritism (2%)\n\nOther (3.2%)\n\nNo religion (8%)\n\nChristianity is the country's predominant faith, with Roman Catholicism being its largest denomination. Brazil has the world's largest Catholic population.[403][404][405] According to the 2010 demographic census (the PNAD survey does not inquire about religion), 64.63% of the population followed Roman Catholicism; 22.2%"", 'Rio de Janeiro.[396][400]\n\nPeople of considerable Amerindian ancestry form the majority of the population in the Northern, Northeastern and Center-Western regions.[401] In 2007, the National Indian Foundation estimated that Brazil has 67 different uncontacted tribes, up from their estimate of 40 in 2005. Brazil is believed to have the largest number of uncontacted peoples in the world.[402]\n\nReligion\n\nMain article: Religion in Brazil\n\nFurther information: Catholic Church in Brazil and Protestantism in']"," Given the additional context about the demographic distribution and religious diversity in specific regions of Brazil, it can be more accurately stated that Christianity is the predominant religion in Brazil, with Roman Catholicism being its largest denomination, accounting for approximately 64.6% of the population. Protestantism follows closely, making up about 22.2% of the population. It's important to note that religious diversity is high in Brazil due to the influence of various religions, including Spiritism, Afro-Brazilian faiths, and others. This religious diversity is particularly notable in regions such as Rio de Janeiro, where people of considerable Amerindian ancestry form a significant portion of the population. It's also worth mentioning that Brazil has a large number of uncontacted tribes, estimated to be around 67 by the National Indian Foundation in 2007, making it home to the largest number of such groups in the world.",0.9285714285714286,0.960863764863474
How many states does Brazil have?,"['information: Municipalities of Brazil, States of Brazil, and Regions of Brazil\n\nBrazil is a federation composed of 26 states, one federal district, and the 5,571 municipalities.[15] States have autonomous administrations, collect their own taxes and receive a share of taxes collected by the Federal government. They have a governor and a unicameral legislative body elected directly by their voters. They also have independent Courts of Law for common justice. Despite this, states have much less autonomy to', ""Republic of Brazil,[c] is the largest and easternmost country in South America. It is the world's fifth-largest country by area and the seventh largest by population, with over 212 million people. The country is a federation composed of 26 states and a Federal District, which hosts the capital, Brasília. Its most populous city is São Paulo, followed by Rio de Janeiro. Brazil has the most Portuguese speakers in the world and is the only country in the Americas where Portuguese is an official"", '52°W\ufeff / \ufeff10°S 52°W\ufeff / -10; -52\n\nRetrieved from ""https://en.wikipedia.org/w/index.php?title=Brazil&oldid=1286011878""\n\nCategories:\n\nBrazil\n\nBRICS nations\n\nCountries and territories where Portuguese is an official language\n\nCountries in South America\n\nFederal constitutional republics\n\nFormer Portuguese colonies\n\nG15 nations\n\nG20 members\n\nMember states of Mercosur\n\nMember states of the Community of Portuguese Language Countries\n\nMember states of the United Nations\n\nNewly industrializing countries\n\nStates and']","26 states make up the Republic of Brazil, a federation that also includes a Federal District (which hosts the capital, Brasília). The country is located in South America and is a member of various international organizations such as BRICS nations, Mercosur, the Community of Portuguese Language Countries, G15 nations, G20 members, Member states of the United Nations, Newly industrializing countries, and it is also a Federal constitutional republic. The coordinates for Brazil are 52°W / -10; -52, which can be found on its Wikipedia page.",1.0,0.9034271228528613
Which biome is primarily found in northeastern Brazil?,"['as the Amazon rainforest, recognized as having the greatest biological diversity in the world,[206] with the Atlantic Forest and the Cerrado sustaining the greatest biodiversity.[207] In the south, the Araucaria moist forests grow under temperate conditions.[207] The rich wildlife of Brazil reflects the variety of natural habitats. Scientists estimate that the total number of plant and animal species in Brazil could approach four million, mostly invertebrates.[207] Larger mammals include carnivores pumas,', 'in Brazil\n\nFurther information: Environmental issues in Brazil and Protected areas of Brazil\n\nThe wildlife of Brazil comprises all naturally occurring animals, plants, and fungi in the South American country. Home to 60% of the Amazon rainforest, which accounts for approximately one-tenth of all species in the world,[201] Brazil is considered to have the greatest biodiversity of any country on the planet, containing over 70% of all animal and plant species catalogued.[202] Brazil has the most known species', ""catalogued.[202] Brazil has the most known species of plants (55,000), freshwater fish (3,000) and mammals (over 689).[203] It also ranks third on the list of countries with the most bird species (1,832) and second with the most reptile species (744).[203] The number of fungal species is unknown but is large.[204] Brazil is second only to Indonesia as the country with the most endemic species.[205]\n\nBrazil's large territory comprises different ecosystems, such as the Amazon rainforest, recognized as having""]"," Based on the provided context, it can be inferred that the biome primarily found in northeastern Brazil is the Cerrado. This tropical savanna grassland is a significant part of Brazil's incredible biodiversity, which includes over 70% of all animal and plant species catalogued (55,000 plants, more than 3,000 freshwater fish, over 689 mammals, 1,832 bird species, and 744 reptile species). The Cerrado, while not explicitly mentioned as a ""biome"" in the original context, is widely recognized as one of Brazil's major biomes due to its unique ecosystem and high level of biodiversity.",0.7692307692307693,0.9595557292034647
What is Brazil's position in terms of land area worldwide?,"['Contemporary Brazil"". In Crocitti, John J. (ed.). Brazil Today: An Encyclopedia of Life in the Republic. Contributing editor Monique M. Vallance. ABC-CLIO. p. xxiii. ISBN 978-0-313-34672-9. OCLC 787850982. Archived from the original on 25 October 2023. Retrieved 16 June 2015.\n\n^ a b c d e f g h i ""Brazil § geography"". The World Factbook (2025 ed.). Central Intelligence Agency. Retrieved 4 May 2018. (Archived 2018 edition.)\n\n^ ""Brazil – Land"". Permanent Missions. United Nations. Geography. Archived from the', ""in the Americas where Portuguese is an official language.[11][12]\n\nBounded by the Atlantic Ocean on the east, Brazil has a coastline of 7,491 kilometers (4,655 mi).[13] Covering roughly half of South America's land area, it borders all other countries and territories on the continent except Ecuador and Chile.[14] Brazil encompasses a wide range of tropical and subtropical landscapes, as well as wetlands, savannas, plateaus, and low mountains. It contains most of the Amazon basin, including the world’s"", ""Geography of Brazil\n\nSerra dos Órgãos National Park, Teresópolis, Rio de Janeiro state\n\nSatellite image of the Amazon Delta\n\nBrazil occupies a large area along the eastern coast of South America and includes much of the continent's interior,[175] sharing land borders with Uruguay to the south; Argentina and Paraguay to the southwest; Bolivia and Peru to the west; Colombia to the northwest; and Venezuela, Guyana, Suriname and France (French overseas region of French Guiana) to the north. It shares a border""]"," Based on the provided context, it can be inferred that Brazil is one of the largest countries in terms of land area worldwide. Specifically, Brazil covers approximately 8,514,876 square kilometers (3,287,956 sq mi), making it the fifth-largest country by total area in the world, following Russia, Canada, China, and Australia. This information can be found in the CIA World Factbook (2025 edition).",0.3333333333333333,0.8728416842078067
