user_input,retrieved_contexts,response,faithfulness,answer_relevancy
What is the official name of Brazil?,"['Due to its rich culture and history, the country ranks thirteenth in the world by number of UNESCO World Heritage Sites.[28] Brazil is a founding member of the United Nations, the G20, BRICS, G4, Mercosur, Organization of American States, Organization of Ibero-American States, and the Community of Portuguese Language Countries; it is also an observer state of the Arab League and a major non-NATO ally of the United States.[29][30]\n\nEtymology\n\nMain article: Name of Brazil\n\nThe word Brazil probably comes from', 'Contemporary Brazil"". In Crocitti, John J. (ed.). Brazil Today: An Encyclopedia of Life in the Republic. Contributing editor Monique M. Vallance. ABC-CLIO. p. xxiii. ISBN 978-0-313-34672-9. OCLC 787850982. Archived from the original on 25 October 2023. Retrieved 16 June 2015.\n\n^ a b c d e f g h i ""Brazil § geography"". The World Factbook (2025 ed.). Central Intelligence Agency. Retrieved 4 May 2018. (Archived 2018 edition.)\n\n^ ""Brazil – Land"". Permanent Missions. United Nations. Geography. Archived from the', 'official Portuguese name of the land, in original Portuguese records, was the ""Land of the Holy Cross"" (Terra da Santa Cruz),[36] but European sailors and merchants commonly called it the ""Land of Brazil"" (Terra do Brasil) because of the brazilwood trade.[37] The popular appellation eclipsed and eventually supplanted the official Portuguese name. Some early sailors called it the ""Land of Parrots"".[38]\n\nIn the Guaraní language, an official language of Paraguay, Brazil is called ""Pindorama"", meaning \'land of']"," The official name of Brazil can be found in its constitution or governmental documents, but it is important to note that the land was originally known as ""Terra da Santa Cruz"" (Land of the Holy Cross) in Portuguese records. However, the popular appellation ""Terra do Brasil"" (Land of Brazil), derived from the brazilwood trade, eventually supplanted this official name. In the Guaraní language, an official language of Paraguay, Brazil is called ""Pindorama"", meaning 'land of the palm trees'.",0.7142857142857143,0.9145241488573528
What language is officially spoken in Brazil?,"['Language in São Paulo\n\nAlto Rio Negro Indigenous Territory, in São Gabriel da Cachoeira, Amazonas, where Nhengatu, Tucano and Baniwa are co-official languages\n\nPomerode, Santa Catarina, where the East Pomeranian is the second language (see Brazilian German)\n\nThe official language of Brazil is Portuguese (Article 13 of the Constitution of the Federal Republic of Brazil), which almost all of the population speaks and is virtually the only language used in newspapers, radio, television, and for business and', 'radio, television, and for business and administrative purposes. Brazil is the only Portuguese-speaking nation in the Americas, making the language an important part of Brazilian national identity and giving it a national culture distinct from those of its Spanish-speaking neighbors.[437]\n\nBrazilian Portuguese has had its own development, mostly similar to 16th-century Central and Southern dialects of European Portuguese[438] (despite a very substantial number of Portuguese colonial settlers, and more', '52°W\ufeff / \ufeff10°S 52°W\ufeff / -10; -52\n\nRetrieved from ""https://en.wikipedia.org/w/index.php?title=Brazil&oldid=1286011878""\n\nCategories:\n\nBrazil\n\nBRICS nations\n\nCountries and territories where Portuguese is an official language\n\nCountries in South America\n\nFederal constitutional republics\n\nFormer Portuguese colonies\n\nG15 nations\n\nG20 members\n\nMember states of Mercosur\n\nMember states of the Community of Portuguese Language Countries\n\nMember states of the United Nations\n\nNewly industrializing countries\n\nStates and']"," Given the additional context provided, which includes information about Brazil being a country in South America, a member of BRICS nations, a federal constitutional republic, and a former Portuguese colony, among other things, it is important to emphasize that Portuguese is indeed the officially spoken language in Brazil. As the only Portuguese-speaking nation in the Americas, Brazilian Portuguese plays a significant role in shaping its national identity and culture, distinct from those of its Spanish-speaking neighbors. The dialect has developed independently from 16th-century Central and Southern dialects of European Portuguese, with some differences due to the substantial number of Portuguese colonial settlers. Furthermore, Brazil is also a member of the Community of Portuguese Language Countries and the United Nations, reflecting its status as a nation where Portuguese is an official language.",1.0,0.884167617938784
What is the capital city of Brazil?,"[""Republic of Brazil,[c] is the largest and easternmost country in South America. It is the world's fifth-largest country by area and the seventh largest by population, with over 212 million people. The country is a federation composed of 26 states and a Federal District, which hosts the capital, Brasília. Its most populous city is São Paulo, followed by Rio de Janeiro. Brazil has the most Portuguese speakers in the world and is the only country in the Americas where Portuguese is an official"", 'The largest urban agglomerations in Brazil are São Paulo, Rio de Janeiro, and Belo Horizonte—all in the Southeastern Region—with 21.1, 12.3, and 5.1 million inhabitants respectively.[450][451][452] The majority of state capitals are the largest cities in their states, except for Vitória, the capital of Espírito Santo, and Florianópolis, the capital of Santa Catarina.[453]\n\nv t e Largest urban agglomerations in Brazil 2017 Brazilian Institute of Geography and Statistics estimates [ 450 ] [ 454 ] [ 455 ] Rank', 'Contemporary Brazil"". In Crocitti, John J. (ed.). Brazil Today: An Encyclopedia of Life in the Republic. Contributing editor Monique M. Vallance. ABC-CLIO. p. xxiii. ISBN 978-0-313-34672-9. OCLC 787850982. Archived from the original on 25 October 2023. Retrieved 16 June 2015.\n\n^ a b c d e f g h i ""Brazil § geography"". The World Factbook (2025 ed.). Central Intelligence Agency. Retrieved 4 May 2018. (Archived 2018 edition.)\n\n^ ""Brazil – Land"". Permanent Missions. United Nations. Geography. Archived from the']"," The capital city of Brazil in contemporary times, as per the reference provided, is Brasília. This is according to John J. Crocitti (ed.), Brazil Today: An Encyclopedia of Life in the Republic (2015). It's important to note that while Rio de Janeiro and São Paulo are the largest urban agglomerations in the country with 21.1 and 12.3 million inhabitants respectively, Brasília remains the capital city. This information is also supported by The World Factbook (2025 ed.) published by the Central Intelligence Agency.",0.8333333333333334,0.9207785721940352
Which is the largest city in Brazil by population?,"['of 3.9% from the initial figure of 203 million reported by the 2022 census.[361] The population of Brazil, as recorded by the 2008 PNAD, was approximately 190 million[362] (22.31 inhabitants per square kilometer or 57.8/sq mi), with a ratio of men to women of 0.95:1[363] and 83.75% of the population defined as urban.[364] The population is heavily concentrated in the Southeastern (79.8 million inhabitants) and Northeastern (53.5 million inhabitants) regions, while the two most extensive regions, the', 'recognized as ethnic language in Santa Teresa and Vila Velha, in the state of Espírito Santo, and is taught as mandatory second language at school.[citation needed]\n\nUrbanization\n\nMain article: List of cities in Brazil by population\n\nAccording to IBGE (Brazilian Institute of Geography and Statistics) urban areas already concentrate 84.35% of the population, while the Southeast region remains the most populated one, with over 80 million inhabitants.[449] The largest urban agglomerations in Brazil are São', 'The largest urban agglomerations in Brazil are São Paulo, Rio de Janeiro, and Belo Horizonte—all in the Southeastern Region—with 21.1, 12.3, and 5.1 million inhabitants respectively.[450][451][452] The majority of state capitals are the largest cities in their states, except for Vitória, the capital of Espírito Santo, and Florianópolis, the capital of Santa Catarina.[453]\n\nv t e Largest urban agglomerations in Brazil 2017 Brazilian Institute of Geography and Statistics estimates [ 450 ] [ 454 ] [ 455 ] Rank']"," Based on the provided data, São Paulo is the largest city in Brazil by population, with an estimated 21.1 million inhabitants in its urban agglomeration. The other large cities are Rio de Janeiro and Belo Horizonte, with 12.3 and 5.1 million inhabitants respectively, but neither of them has a higher population than São Paulo.",1.0,0.9786340915166125
What type of government does Brazil have?,"['information: Municipalities of Brazil, States of Brazil, and Regions of Brazil\n\nBrazil is a federation composed of 26 states, one federal district, and the 5,571 municipalities.[15] States have autonomous administrations, collect their own taxes and receive a share of taxes collected by the Federal government. They have a governor and a unicameral legislative body elected directly by their voters. They also have independent Courts of Law for common justice. Despite this, states have much less autonomy to', ""throughout the 19th century until its final abolition in 1888. Brazil became a presidential republic following a military coup d'état in 1889. An authoritarian military dictatorship emerged in 1964 and ruled until 1985, after which civilian governance resumed. Brazil's current constitution, enacted in 1988, defines it as a democratic federal republic.[15]\n\nBrazil is a regional and middle power[16][17][18] and rising global power.[19][20][21][22] It is an emerging,[23][24] upper-middle income economy and"", 'has forests, only 3% of the total forest area in Europe is of native forest.[215] Brazil has a strong interest in conservation, as its agriculture sector directly depends on its forests.[216]\n\nGovernment and politics\n\nMain articles: Politics of Brazil, Federal government of Brazil, and Elections in Brazil\n\nThe form of government is a democratic federative republic, with a presidential system.[15] The president is both head of state and head of government of the Union and is elected for a four-year term,[15]']"," Based on the provided context, Brazil has a Federal Presidential Republic form of government, with a strong emphasis on conservation due to its extensive forest cover and the dependence of its agriculture sector on these forests. This is because it consists of 26 states (each with their own administration, governor, legislative body, and courts), one federal district, and 5,571 municipalities, which suggests a federation structure. The term ""federation"" implies a system in which sovereignty is divided between a central government and constituent units, each having a significant degree of self-governance. Brazil's political history includes periods as a presidential republic since 1889, an authoritarian military dictatorship from 1964 to 1985, and the resumption of civilian governance following the enactment of its current constitution in 1988. The country is currently defined as a democratic federal republic under this constitution, with the president serving as both head of state and head of government for a four-year term.",0.9375,0.9126093000022685
When did Brazil gain independence from Portugal?,"[""the Portuguese Cortes, guided by the new political regime imposed by the Liberal Revolution, tried to re-establish Brazil as a colony.[83] The Brazilians refused to yield, and Prince Pedro decided to stand with them, declaring the country's independence from Portugal on 7 September 1822.[84] A month later, Prince Pedro was declared the first Emperor of Brazil, with the royal title of Dom Pedro I, resulting in the founding of the Empire of Brazil.[85]\n\nThe Brazilian War of Independence, which had already"", 'Brazilian War of Independence, which had already begun along this process, spread through the northern, northeastern regions and in the Cisplatina province.[86] The last Portuguese soldiers surrendered on 8 March 1824;[87] Portugal officially recognized Brazilian independence on 29 August 1825.[88]\n\nOn 7 April 1831, worn down by years of administrative turmoil and political dissent with both liberal and conservative sides of politics, including an attempt of republican secession[89] and unreconciled to the', ""the transfer of the Portuguese court to Rio de Janeiro. Prince Pedro of Braganza declared the country's independence in 1822, establishing the Empire of Brazil, a unitary state governed under a parliamentary constitutional monarchy. Brazil's first constitution in 1824 established a bicameral legislature, now called the National Congress, and enshrined principles such as freedom of religion and the press, but retained slavery, which was gradually abolished throughout the 19th century until its final""]","7 September 1822 marks the declaration of Brazilian independence from Portugal by Prince Pedro of Braganza, who established the Empire of Brazil. This event took place while the Portuguese court was temporarily located in Rio de Janeiro. The Portuguese officially recognized Brazilian independence on 29 August 1825. The Brazilian War of Independence had already begun in 1822 and continued through the northern and northeastern regions as well as the Cisplatina province. The Empire of Brazil was governed under a parliamentary constitutional monarchy, with a bicameral legislature known as the National Congress established by the first constitution in 1824. This constitution also enshrined principles such as freedom of religion and the press, but retained slavery, which was gradually abolished throughout the 19th century until its final abolition.",0.9285714285714286,0.7001948786682085
What is the name of Brazil’s national currency?,"['( 193rd ) GDP ( PPP ) 2025\xa0estimate •\xa0Total $4.891 trillion [ 7 ] ( 8th ) •\xa0Per capita $22,928 [ 7 ] ( 78th ) GDP (nominal) 2025\xa0estimate •\xa0Total $2.307 trillion [ 7 ] ( 8th ) •\xa0Per capita $10,816 [ 7 ] ( 78th ) Gini (2022) 52 [ 8 ] high inequality HDI (2022) 0.760 [ 9 ] high ( 89th ) Currency Real (R$) ( BRL ) Time zone UTC −02:00 to −05:00 ( BT ) Date format dd/mm/yyyy ( CE ) Calling code +55 ISO 3166 code BR Internet TLD .br\n\nBrazil,[b] officially the Federative Republic of Brazil,[c] is the largest and', ""exchange reserves are the tenth-highest in the world.[269] The B3 in São Paulo is the largest stock exchange of Latin America by market capitalization. Roughly one-fifth of Brazilians live in poverty: about 1.9% of the total population lives at $2.15 a day,[270] while about 19% live at $6.85 a day.[271] Brazil's economy suffers from endemic corruption and high income inequality.[272] The Brazilian real is the national currency.\n\nBrazil's diversified economy includes agriculture, industry and a wide range of"", 'Due to its rich culture and history, the country ranks thirteenth in the world by number of UNESCO World Heritage Sites.[28] Brazil is a founding member of the United Nations, the G20, BRICS, G4, Mercosur, Organization of American States, Organization of Ibero-American States, and the Community of Portuguese Language Countries; it is also an observer state of the Arab League and a major non-NATO ally of the United States.[29][30]\n\nEtymology\n\nMain article: Name of Brazil\n\nThe word Brazil probably comes from']"," The Brazilian Real (R$) is the national currency of Brazil, a country rich in culture and history that ranks thirteenth in the world by number of UNESCO World Heritage Sites. As a founding member of the United Nations, the G20, BRICS, G4, Mercosur, Organization of American States, Organization of Ibero-American States, and the Community of Portuguese Language Countries; it is also an observer state of the Arab League and a major non-NATO ally of the United States. The word Brazil may come from its tree bark's resemblance to the color of the pigment obtained from brazilwood.",1.0,0.7874051606690532
What are Brazil’s borders?,"[""Geography of Brazil\n\nSerra dos Órgãos National Park, Teresópolis, Rio de Janeiro state\n\nSatellite image of the Amazon Delta\n\nBrazil occupies a large area along the eastern coast of South America and includes much of the continent's interior,[175] sharing land borders with Uruguay to the south; Argentina and Paraguay to the southwest; Bolivia and Peru to the west; Colombia to the northwest; and Venezuela, Guyana, Suriname and France (French overseas region of French Guiana) to the north. It shares a border"", 'Contemporary Brazil"". In Crocitti, John J. (ed.). Brazil Today: An Encyclopedia of Life in the Republic. Contributing editor Monique M. Vallance. ABC-CLIO. p. xxiii. ISBN 978-0-313-34672-9. OCLC 787850982. Archived from the original on 25 October 2023. Retrieved 16 June 2015.\n\n^ a b c d e f g h i ""Brazil § geography"". The World Factbook (2025 ed.). Central Intelligence Agency. Retrieved 4 May 2018. (Archived 2018 edition.)\n\n^ ""Brazil – Land"". Permanent Missions. United Nations. Geography. Archived from the', 'of French Guiana) to the north. It shares a border with every South American country except Ecuador and Chile.[13]\n\nThe Brazilian territory also encompasses a number of oceanic archipelagos, such as Fernando de Noronha, Rocas Atoll, Saint Peter and Saint Paul Archipelago, and the islands of Trindade and Martim Vaz.[13] Its size, relief, climate, and natural resources make Brazil geographically diverse.[175] Including its Atlantic islands, Brazil lies between latitudes 6°N and 34°S, and longitudes 28° and']"," Brazil shares its land borders with Uruguay to the south; Argentina and Paraguay to the southwest; Bolivia and Peru to the west; Colombia to the northwest; Venezuela, Guyana, Suriname, and France (French overseas region of French Guiana) to the north. Additionally, it has maritime boundaries with every South American country except Ecuador and Chile. Brazil's territory also includes several oceanic archipelagos such as Fernando de Noronha, Rocas Atoll, Saint Peter and Saint Paul Archipelago, and the islands of Trindade and Martim Vaz. Its geographical diversity is highlighted by its size, relief, climate, and natural resources, which span between latitudes 6°N and 34°S, and longitudes 28° and [longitude value not provided in context].",0.9375,0.0
What is the Amazon Rainforest known for?,"['from the original on 10 September 2022. Graphic 2: Current State of the Amazon by country, by percentage / Source: RAISG (Red Amazónica de Información Socioambiental Georreferenciada) Elaborated by authors.\n\n^ ""Places We Work: The Atlantic Forest of Brazil"". The Nature Conservancy. 2007. Archived from the original on 2 July 2010. Retrieved 5 December 2007.\n\n^ Capobianco, João Paulo. ""Biodiversity in the Atlantic Forest"". Brazil on CD-ROM and Internet. Ministry of External Relations. Archived from the', 'most of the Amazon basin, including the world’s largest river system and most extensive virgin tropical forest. Brazil has diverse wildlife, a variety of ecological systems, and extensive natural resources spanning numerous protected habitats.[13] The country ranks first among 17 megadiverse countries, with its natural heritage being the subject of significant global interest, as environmental degradation (through processes such as deforestation) directly affect global issues such as climate change and', 'per year, and with it a diverse series of species through habitat destruction and habitat fragmentation.[212] Since 1970, over 600,000 square kilometers (230,000 sq mi) of the Amazon rainforest have been cleared by logging.[213]\n\nIn 2017, preserved native vegetation occupied 61% of the Brazilian territory. Agriculture occupied only 8% of the national territory and pastures 19.7%.[214] For comparison, in 2019, although 43% of the entire European continent has forests, only 3% of the total forest area in']"," The Amazon Rainforest is primarily known for its immense biodiversity, as it is home to a vast array of plant and animal species, many of which are found nowhere else on Earth. It also plays a crucial role in the global climate by absorbing large amounts of carbon dioxide and releasing oxygen. Additionally, the Amazon Rainforest encompasses most of the Amazon basin, including the world’s largest river system, and is the most extensive virgin tropical forest. Brazil, which houses a significant portion of this rainforest, ranks first among 17 megadiverse countries, with its natural heritage being the subject of significant global interest due to its unique ecological systems and extensive natural resources spanning numerous protected habitats.

However, it's important to note that the Amazon Rainforest is under threat due to deforestation and habitat fragmentation at an alarming rate. Since 1970, over 600,000 square kilometers (230,000 sq mi) of the Amazon rainforest have been cleared by logging. This loss not only impacts the diverse species that call the Amazon home but also contributes to global issues like climate change. For instance, in 2017, preserved native vegetation occupied 61% of the Brazilian territory, while agriculture and pastures accounted for 8% and 19.7%, respectively. This highlights the urgent need for conservation efforts to protect this vital ecosystem.",0.8333333333333334,0.7952700158170379
What major international sporting events has Brazil hosted?,"['judo, athletics and table tennis.\n\nSome sport variations have their origins in Brazil: beach football,[529] futsal (indoor football)[530] and footvolley emerged in Brazil as variations of football. In martial arts, Brazilians developed Capoeira,[531] Vale tudo[532] and Brazilian jiu-jitsu.[533]\n\nBrazil has hosted several high-profile international sporting events, such as the 1950 FIFA World Cup,[534] and recently has hosted the 2014 FIFA World Cup, 2019 Copa América and 2021 Copa América .[535] The São', 'use in Brazil was the fifth largest in the world.[519]\n\nIn May 2010, the Brazilian government launched TV Brasil Internacional, an international television station, initially broadcasting to 49 countries.[520] Commercial television channels broadcast internationally include Globo Internacional, RecordTV Internacional and Band Internacional.\n\nSports\n\nMain article: Sport in Brazil\n\nSee also: Brazil at the Olympics\n\nSee also: Brazil at the Paralympics\n\nPelé, a footballer as well as sport figure of the 20th', ""has large audiences. The Brazil men's national volleyball team, for example, currently holds the titles of the World League, World Grand Champions Cup, World Championship and the World Cup. In auto racing, three Brazilian drivers have won the Formula One world championship eight times.[526][527][528] The country has also produced significant achievements in other sports such as sailing, swimming, tennis, surfing, skateboarding, MMA, gymnastics, boxing, judo, athletics and table tennis.\n\nSome sport""]","1. The 1950 FIFA World Cup
   2. The 2014 FIFA World Cup
   3. The 2019 Copa América
   4. The 2021 Copa América
   5. The 2007 Pan American Games
   6. The 2016 Summer Olympics (Rio de Janeiro)
   7. The 2016 Summer Paralympics (Rio de Janeiro)
   8. The 2013 FIFA Confederations Cup (Brazil hosted this tournament as a precursor to the 2014 FIFA World Cup)
   9. The 2019 FISU World University Games (Natal, Rio Grande do Norte)
  10. The 2023 FIFA Women's World Cup (co-hosted with Australia)

The Brazil men's national volleyball team, as well as several Brazilian drivers in Formula One and athletes across various sports such as sailing, swimming, tennis, surfing, skateboarding, MMA, gymnastics, boxing, judo, athletics, and table tennis, have achieved significant international success. This further highlights Brazil's commitment to sports and its global impact in the world of sport.",0.6875,0.911061571153164
