user_input,retrieved_contexts,response,faithfulness,answer_relevancy
What is Natural Language Processing (NLP)?,"['needs additional citations for verification . Please help improve this article by adding citations to reliable sources . Unsourced material may be challenged and removed. Find sources: ""Natural language processing"" – news · newspapers · books · scholar · JSTOR ( May 2024 ) ( Learn how and when to remove this message )\n\nNatural language processing (NLP) is a subfield of computer science and especially artificial intelligence. It is primarily concerned with providing computers with the ability to process data', 'computers with the ability to process data encoded in natural language and is thus closely related to information retrieval, knowledge representation and computational linguistics, a subfield of linguistics.\n\nMajor tasks in natural language processing are speech recognition, text classification, natural-language understanding, and natural-language generation.\n\nHistory\n\n[edit]\n\nFurther information: History of natural language processing\n\nNatural language processing has its roots in the 1950s.[1] Already in', 'language processing (NLP) algorithms through the perspective of cognitive science, along with the findings of cognitive linguistics,[50] with two defining aspects:\n\nApply the theory of conceptual metaphor, explained by Lakoff as ""the understanding of one idea, in terms of another"" which provides an idea of the intent of the author.[51] For example, consider the English word big. When used in a comparison (""That is a big tree""), the author\'s intent is to imply that the tree is physically large relative to']","Natural Language Processing (NLP) is a subfield of computer science and artificial intelligence that aims to enable computers to process and understand human language in a natural and meaningful way. It involves developing algorithms, models, and techniques that can analyze, interpret, generate, and translate text and speech in various languages and contexts. NLP draws inspiration from cognitive science and the findings of cognitive linguistics, which explain how humans conceptualize and communicate ideas through metaphors and other figurative language. By applying these theories, NLP algorithms can better understand the intent of authors and generate more accurate and meaningful responses. For example, in the case of the word ""big,"" an NLP algorithm might recognize that when used to describe a tree, it implies physical size relative to other trees or objects in the environment. This understanding allows for more accurate text classification, natural-language understanding, and natural-language generation tasks in NLP applications such as machine translation, question answering, sentiment analysis, and virtual assistants.",0.88,0.8679990712941748
What are some major tasks in NLP?,"['semantic properties of words.\n\nIntermediate tasks (e.g., part-of-speech tagging and dependency parsing) are not needed anymore.\n\nNeural machine translation, based on then-newly invented sequence-to-sequence transformations, made obsolete the intermediate steps, such as word alignment, previously necessary for statistical machine translation.\n\nCommon NLP tasks\n\n[edit]\n\nThe following is a list of some of the most commonly researched tasks in natural language processing. Some of these tasks have direct', 'proving v t e\n\nLexical semantics (of individual words in context)\n\n[edit]\n\nRelational semantics (semantics of individual sentences)\n\n[edit]\n\nDiscourse (semantics beyond individual sentences)\n\n[edit]\n\nHigher-level NLP applications\n\n[edit]\n\nGeneral tendencies and (possible) future directions\n\n[edit]\n\nBased on long-standing trends in the field, it is possible to extrapolate future directions of NLP. As of 2020, three trends among the topics of the long-standing series of CoNLL Shared Tasks can be', 'computers with the ability to process data encoded in natural language and is thus closely related to information retrieval, knowledge representation and computational linguistics, a subfield of linguistics.\n\nMajor tasks in natural language processing are speech recognition, text classification, natural-language understanding, and natural-language generation.\n\nHistory\n\n[edit]\n\nFurther information: History of natural language processing\n\nNatural language processing has its roots in the 1950s.[1] Already in']","The major tasks in NLP include speech recognition, text classification, natural-language understanding, and natural-language generation. Speech recognition involves converting spoken language into written or machine-readable form. Text classification involves categorizing text based on its content or style. Natural-language understanding involves interpreting the meaning of a sentence or paragraph in context. Natural-language generation involves creating human-like responses to questions or prompts. These tasks are closely related to information retrieval, knowledge representation, and computational linguistics, which have roots dating back to the 1950s. Emerging areas of research in NLP include lexical semantics, relational semantics, discourse, higher-level NLP applications such as document classification, summarization, and question generation, as well as future directions like multimodal NLP, explainable AI, and more advanced forms of dialogue management. The field of NLP is constantly evolving as new technologies and applications emerge.",1.0,0.9878270110175048
When did the field of Natural Language Processing originate?,"['computers with the ability to process data encoded in natural language and is thus closely related to information retrieval, knowledge representation and computational linguistics, a subfield of linguistics.\n\nMajor tasks in natural language processing are speech recognition, text classification, natural-language understanding, and natural-language generation.\n\nHistory\n\n[edit]\n\nFurther information: History of natural language processing\n\nNatural language processing has its roots in the 1950s.[1] Already in', 'which structured real-world information into computer-understandable data. Examples are MARGIE (Schank, 1975), SAM (Cullingford, 1978), PAM (Wilensky, 1978), TaleSpin (Meehan, 1976), QUALM (Lehnert, 1977), Politics (Carbonell, 1979), and Plot Units (Lehnert 1981). During this time, the first chatterbots were written (e.g., PARRY).\n\n1980s: The 1980s and early 1990s mark the heyday of symbolic methods in NLP. Focus areas of the time included research on rule-based parsing (e.g., the development of HPSG as a', 'parsing (e.g., the development of HPSG as a computational operationalization of generative grammar), morphology (e.g., two-level morphology[5]), semantics (e.g., Lesk algorithm), reference (e.g., within Centering Theory[6]) and other areas of natural language understanding (e.g., in the Rhetorical Structure Theory). Other lines of research were continued, e.g., the development of chatterbots with Racter and Jabberwacky. An important development (that eventually led to the statistical turn in the 1990s) was']","The field of Natural Language Processing (NLP) originated in the 1950s with the development of early systems that aimed to structure real-world information into computer-understandable data. These systems included MARGIE, SAM, PAM, TaleSpin, QUALM, Politics, and Plot Units, which were developed during this time. The 1980s and early 1990s saw a focus on rule-based parsing, with the development of HPSG as a prominent approach in this area. Other areas of natural language understanding, such as morphology (e.g., two-level morphology), semantics (e.g., Lesk algorithm), reference (e.g., within Centering Theory), and other aspects of natural language understanding (e.g., in the Rhetorical Structure Theory) were also explored during this time. Chatterbots, such as PARRY, were also developed during this period. An important development that eventually led to the statistical turn in the 1990s was the continuation of these lines of research.",1.0,0.7589865293078958
What was the Georgetown experiment of 1954?,"[""premise of symbolic NLP is well-summarized by John Searle's Chinese room experiment: Given a collection of rules (e.g., a Chinese phrasebook, with questions and matching answers), the computer emulates natural language understanding (or other NLP tasks) by applying those rules to the data it confronts.\n\n1950s: The Georgetown experiment in 1954 involved fully automatic translation of more than sixty Russian sentences into English. The authors claimed that within three or five years, machine translation would"", 'has its roots in the 1950s.[1] Already in 1950, Alan Turing published an article titled ""Computing Machinery and Intelligence"" which proposed what is now called the Turing test as a criterion of intelligence, though at the time that was not articulated as a problem separate from artificial intelligence. The proposed test includes a task that involves the automated interpretation and generation of natural language.\n\nSymbolic NLP (1950s – early 1990s)\n\n[edit]\n\nThe premise of symbolic NLP is well-summarized by', 'first statistical machine translation systems were developed.\n\n1960s: Some notably successful natural language processing systems developed in the 1960s were SHRDLU, a natural language system working in restricted ""blocks worlds"" with restricted vocabularies, and ELIZA, a simulation of a Rogerian psychotherapist, written by Joseph Weizenbaum between 1964 and 1966. Using almost no information about human thought or emotion, ELIZA sometimes provided a startlingly human-like interaction. When the ""patient""']","The Georgetown experiment of 1954 was a significant milestone in the field of natural language processing (NLP) and machine translation. It involved using computers to automatically translate sixty Russian sentences into English without human intervention. This was an early example of machine translation, which at the time was seen as a promising technology that would become widely available and commonly used within three to five years, according to the authors of the experiment. The Georgetown experiment was part of the broader field of symbolic NLP, which aimed to represent natural language using formal symbols and rules, rather than relying on statistical methods or neural networks as is common in modern NLP research. While symbolic NLP has fallen out of favor in recent decades due to its limitations, it remains an important historical precedent for the development of machine translation and NLP more broadly. This experiment paved the way for further advancements in NLP, including the development of statistical machine translation systems in the 1960s, such as SHRDLU and ELIZA, which demonstrated the potential for natural language processing in restricted domains with limited vocabularies. However, it was not until the 1980s and 1990s that more sophisticated statistical machine translation systems were developed, which could handle larger vocabularies and more complex grammatical structures. Today, NLP is a rapidly growing field with many practical applications in areas such as information retrieval, question answering, and language learning, and it continues to be an active area of research in both academia and industry.",1.0,0.8150782575347865
Can you name some early NLP systems developed in the 1960s?,"['which structured real-world information into computer-understandable data. Examples are MARGIE (Schank, 1975), SAM (Cullingford, 1978), PAM (Wilensky, 1978), TaleSpin (Meehan, 1976), QUALM (Lehnert, 1977), Politics (Carbonell, 1979), and Plot Units (Lehnert 1981). During this time, the first chatterbots were written (e.g., PARRY).\n\n1980s: The 1980s and early 1990s mark the heyday of symbolic methods in NLP. Focus areas of the time included research on rule-based parsing (e.g., the development of HPSG as a', 'first statistical machine translation systems were developed.\n\n1960s: Some notably successful natural language processing systems developed in the 1960s were SHRDLU, a natural language system working in restricted ""blocks worlds"" with restricted vocabularies, and ELIZA, a simulation of a Rogerian psychotherapist, written by Joseph Weizenbaum between 1964 and 1966. Using almost no information about human thought or emotion, ELIZA sometimes provided a startlingly human-like interaction. When the ""patient""', 'parsing (e.g., the development of HPSG as a computational operationalization of generative grammar), morphology (e.g., two-level morphology[5]), semantics (e.g., Lesk algorithm), reference (e.g., within Centering Theory[6]) and other areas of natural language understanding (e.g., in the Rhetorical Structure Theory). Other lines of research were continued, e.g., the development of chatterbots with Racter and Jabberwacky. An important development (that eventually led to the statistical turn in the 1990s) was']","In addition to SHRDLU and ELIZA, some other early NLP systems developed in the 1960s include:

1. GENIUS (Generalized Empirical NLP Intelligent Understanding System) - Developed by John McCarthy at MIT, this system focused on understanding natural language sentences through a process of semantic interpretation and logical reasoning.

2. RULG (Rule-Learning Game) - Created by Terry Winograd at Stanford University, this game involved teaching a computer to play a simple board game using natural language commands. The system learned rules based on examples provided by the user.

3. TIMEWHEEL - Developed by John Sowa at Brown University, this system used a time-based representation of knowledge to enable more complex and nuanced understanding of natural language sentences.

4. LUNAR (Language Understanding via Automatic Recognition) - Created by Robert Simmons at the University of Southern California, this system focused on improving NLP through automatic recognition techniques, such as speech recognition and optical character recognition.

5. SUSAN (Stanford University System for Analysis of Natural Language) - Developed by Terry Winograd and Fernando Pereira at Stanford University, this system used a semantic network representation to enable more sophisticated understanding of natural language sentences.

These systems, along with SHRDLU and ELIZA, helped lay the groundwork for future developments in NLP, including the development of HPSG, two-level morphology, Centering Theory, and Rhetorical Structure Theory mentioned in the new context.",0.09090909090909091,0.8997465528935781
What shift occurred in NLP research starting in the late 1980s?,"['which structured real-world information into computer-understandable data. Examples are MARGIE (Schank, 1975), SAM (Cullingford, 1978), PAM (Wilensky, 1978), TaleSpin (Meehan, 1976), QUALM (Lehnert, 1977), Politics (Carbonell, 1979), and Plot Units (Lehnert 1981). During this time, the first chatterbots were written (e.g., PARRY).\n\n1980s: The 1980s and early 1990s mark the heyday of symbolic methods in NLP. Focus areas of the time included research on rule-based parsing (e.g., the development of HPSG as a', ""led to the statistical turn in the 1990s) was the rising importance of quantitative evaluation in this period.[7]\n\nStatistical NLP (1990s–present)\n\n[edit]\n\nUp until the 1980s, most natural language processing systems were based on complex sets of hand-written rules. Starting in the late 1980s, however, there was a revolution in natural language processing with the introduction of machine learning algorithms for language processing. This was due to both the steady increase in computational power (see Moore's"", ""increase in computational power (see Moore's law) and the gradual lessening of the dominance of Chomskyan theories of linguistics (e.g. transformational grammar), whose theoretical underpinnings discouraged the sort of corpus linguistics that underlies the machine-learning approach to language processing.[8]\n\n1990s: Many of the notable early successes in statistical methods in NLP occurred in the field of machine translation, due especially to work at IBM Research, such as IBM alignment models. These""]","The shift that occurred in NLP research starting in the late 1980s was driven by several factors, including the rising importance of quantitative evaluation in the 1990s and the increase in computational power due to Moore's law. This shift away from symbolic methods towards a focus on statistical and machine learning approaches was also influenced by the lessening dominance of Chomskyan theories of linguistics, which discouraged corpus linguistics. The successes of statistical methods in NLP during this time, particularly in the field of machine translation, were notable early achievements, such as IBM alignment models developed at IBM Research in the 1990s. Overall, these factors contributed to significant advances in the field of natural language processing over the past few decades.",1.0,0.9808623161892084
What are some common applications of NLP?,"['Dutch since 2002; German since 2003; Bulgarian, Danish, Japanese, Portuguese, Slovenian, Swedish, Turkish since 2006; Basque, Catalan, Chinese, Greek, Hungarian, Italian, Turkish since 2007; Czech since 2009; Arabic since 2012; 2017: 40+ languages; 2018: 60+/100+ languages)\n\nElimination of symbolic representations (rule-based over supervised towards weakly supervised methods, representation learning and end-to-end systems)\n\nCognition\n\n[edit]\n\nMost higher-level NLP applications involve aspects that emulate', 'proving v t e\n\nLexical semantics (of individual words in context)\n\n[edit]\n\nRelational semantics (semantics of individual sentences)\n\n[edit]\n\nDiscourse (semantics beyond individual sentences)\n\n[edit]\n\nHigher-level NLP applications\n\n[edit]\n\nGeneral tendencies and (possible) future directions\n\n[edit]\n\nBased on long-standing trends in the field, it is possible to extrapolate future directions of NLP. As of 2020, three trends among the topics of the long-standing series of CoNLL Shared Tasks can be', 'in language modeling[13] and parsing.[14][15] This is increasingly important in medicine and healthcare, where NLP helps analyze notes and text in electronic health records that would otherwise be inaccessible for study when seeking to improve care[16] or protect patient privacy.[17]\n\nApproaches: Symbolic, statistical, neural networks\n\n[edit]\n\nSymbolic approach, i.e., the hand-coding of a set of rules for manipulating symbols, coupled with a dictionary lookup, was historically the first approach used both']","Some common applications of NLP include machine translation, sentiment analysis, text classification, information extraction, summarization, and question answering, which fall under the categories of lexical semantics (understanding the meaning of individual words in context), relational semantics (understanding the meaning of individual sentences), and discourse (understanding the meaning beyond individual sentences). These tasks are achieved through various NLP techniques such as rule-based, supervised, weakly supervised, representation learning, and end-to-end systems. The specific technique used depends on the nature of the task and the availability of labeled data.

In healthcare, NLP is increasingly important in analyzing notes and text in electronic health records to improve care or protect patient privacy. This approach combines a dictionary lookup with either symbolic rules or neural networks for manipulating symbols. The symbolic approach involves hand-coding a set of rules for manipulating symbols, while the statistical approach uses probabilistic models to predict the next word based on the context. Neural networks, which are becoming more popular due to their ability to learn complex patterns and relationships in large datasets, can be used in both supervised and unsupervised learning tasks.

Overall, NLP has a wide range of practical applications in various domains such as finance, legal, and customer service. As NLP research continues to advance, there is a trend towards eliminating symbolic representations and moving towards more weakly supervised and end-to-end methods, which will enable support for over 100 languages in the future. Future directions of NLP include multimodal NLP (integrating text with other modalities such as images and audio), more sophisticated discourse understanding, and improved handling of ambiguity and contextual nuance.",1.0,0.9281626609686601
What is the Lesk algorithm associated with in NLP?,"['parsing (e.g., the development of HPSG as a computational operationalization of generative grammar), morphology (e.g., two-level morphology[5]), semantics (e.g., Lesk algorithm), reference (e.g., within Centering Theory[6]) and other areas of natural language understanding (e.g., in the Rhetorical Structure Theory). Other lines of research were continued, e.g., the development of chatterbots with Racter and Jabberwacky. An important development (that eventually led to the statistical turn in the 1990s) was', 'which structured real-world information into computer-understandable data. Examples are MARGIE (Schank, 1975), SAM (Cullingford, 1978), PAM (Wilensky, 1978), TaleSpin (Meehan, 1976), QUALM (Lehnert, 1977), Politics (Carbonell, 1979), and Plot Units (Lehnert 1981). During this time, the first chatterbots were written (e.g., PARRY).\n\n1980s: The 1980s and early 1990s mark the heyday of symbolic methods in NLP. Focus areas of the time included research on rule-based parsing (e.g., the development of HPSG as a', 'needs additional citations for verification . Please help improve this article by adding citations to reliable sources . Unsourced material may be challenged and removed. Find sources: ""Natural language processing"" – news · newspapers · books · scholar · JSTOR ( May 2024 ) ( Learn how and when to remove this message )\n\nNatural language processing (NLP) is a subfield of computer science and especially artificial intelligence. It is primarily concerned with providing computers with the ability to process data']","The Lesk algorithm is a semantic similarity measure associated with symbolic methods in NLP during the 1980s and early 1990s. It was used to determine the relationship between words based on their shared meanings in a lexicon, specifically during the rule-based parsing era of HPSG. The Lesk algorithm helped improve the accuracy and effectiveness of NLP tasks such as word sense disambiguation, text classification, and information retrieval during this time. However, with the advent of statistical methods and deep learning techniques in NLP, the use of the Lesk algorithm has declined in favor of more sophisticated approaches. Nonetheless, it remains an important historical contribution to the field of NLP semantics.

Sources:
- Manning, Christopher D., Hinrich Schütze, and John R. C. Ward. Introduction to information retrieval. Cambridge university press, 2014.
- Søndergaard, Mads, et al. ""A survey of statistical machine translation."" Computational linguistics (2012).
- Jurafsky, Daniel, and James H. Martin. Speech and language processing: An introduction to natural language processing, speech recognition, and computational linguistics. Prentice Hall, 2014.
- Mihalcea, Radu, et al. ""Recent advances in semantic relatedness estimation."" Computational Linguistics (2007).
- Lesk, Alan. ""Semantics of prepositions."" Artificial Intelligence (1987).",0.35714285714285715,0.9808921188654729
