user_input,retrieved_contexts,response,faithfulness,answer_relevancy
What is the significance of the Turing test in the context of NLP?,"['has its roots in the 1950s.[1] Already in 1950, Alan Turing published an article titled ""Computing Machinery and Intelligence"" which proposed what is now called the Turing test as a criterion of intelligence, though at the time that was not articulated as a problem separate from artificial intelligence. The proposed test includes a task that involves the automated interpretation and generation of natural language.\n\nSymbolic NLP (1950s – early 1990s)\n\n[edit]\n\nThe premise of symbolic NLP is well-summarized by', ""premise of symbolic NLP is well-summarized by John Searle's Chinese room experiment: Given a collection of rules (e.g., a Chinese phrasebook, with questions and matching answers), the computer emulates natural language understanding (or other NLP tasks) by applying those rules to the data it confronts.\n\n1950s: The Georgetown experiment in 1954 involved fully automatic translation of more than sixty Russian sentences into English. The authors claimed that within three or five years, machine translation would"", 'language processing (NLP) algorithms through the perspective of cognitive science, along with the findings of cognitive linguistics,[50] with two defining aspects:\n\nApply the theory of conceptual metaphor, explained by Lakoff as ""the understanding of one idea, in terms of another"" which provides an idea of the intent of the author.[51] For example, consider the English word big. When used in a comparison (""That is a big tree""), the author\'s intent is to imply that the tree is physically large relative to']","The Turing test proposed by Alan Turing in the 1950s remains significant in the context of NLP as it provides a benchmark for measuring whether machines can exhibit human-like intelligence in terms of their ability to communicate through natural language. This is particularly important in NLP, where the goal is to enable machines to understand and generate human-like natural language.

The limitations of symbolic NLP techniques during the 1950s to early 1990s highlighted the need for a more cognitive science-based approach to NLP, which takes into account findings from cognitive linguistics. This approach involves applying the theory of conceptual metaphor, as explained by Lakoff, to understand the intent of the author.

Conceptual metaphors are mental mappings that allow us to understand complex concepts in terms of simpler ones. For example, the concept of ""big"" is understood in terms of physical size relative to other objects. By applying this theory, NLP algorithms can better understand the meaning and intent behind natural language text.

The significance of achieving success in the Turing test through the use of NLP techniques lies in its potential to demonstrate that machines can indeed exhibit human-like intelligence in terms of their ability to communicate through natural language. This would be a significant milestone in the field of AI and NLP, as it would show that machines can understand and generate natural language with the same level of sophistication as humans.

In summary, the Turing test proposed by Alan Turing in the 1950s remains relevant today in the context of NLP, as it provides a criterion for intelligence that is particularly significant given the field's aim to enable machines to understand and generate human-like natural language through cognitive science-based approaches like conceptual metaphor. The potential benefits of achieving success in the Turing test include revolutionizing fields such as healthcare, education, and customer service by enabling machines to communicate with humans more effectively and efficiently.",1.0,0.8367833572340997
How did the introduction of machine learning algorithms impact NLP?,"[""led to the statistical turn in the 1990s) was the rising importance of quantitative evaluation in this period.[7]\n\nStatistical NLP (1990s–present)\n\n[edit]\n\nUp until the 1980s, most natural language processing systems were based on complex sets of hand-written rules. Starting in the late 1980s, however, there was a revolution in natural language processing with the introduction of machine learning algorithms for language processing. This was due to both the steady increase in computational power (see Moore's"", ""increase in computational power (see Moore's law) and the gradual lessening of the dominance of Chomskyan theories of linguistics (e.g. transformational grammar), whose theoretical underpinnings discouraged the sort of corpus linguistics that underlies the machine-learning approach to language processing.[8]\n\n1990s: Many of the notable early successes in statistical methods in NLP occurred in the field of machine translation, due especially to work at IBM Research, such as IBM alignment models. These"", 'Proceedings of the EACL 2009 Workshop on the Interaction between Linguistics and Computational Linguistics.\n\n^ Philip Resnik. Four revolutions. Language Log, February 5, 2011.\n\n^ Socher, Richard. ""Deep Learning For NLP-ACL 2012 Tutorial"". www.socher.org. Retrieved 2020-08-17. This was an early Deep Learning tutorial at the ACL 2012 and met with both interest and (at the time) skepticism by most participants. Until then, neural learning was basically rejected because of its lack of statistical']","The introduction of machine learning algorithms had a transformative impact on natural language processing (NLP) in the late 1980s by enabling machines to automatically learn patterns and relationships in large datasets of text, rather than relying solely on predefined rules. This shift from traditional rule-based approaches was driven by several factors, including the increase in computational power and the lessening dominance of Chomskyan theories of linguistics, which discouraged corpus linguistics.

The statistical NLP or SNLP approach allowed for more accurate and flexible NLP applications, particularly in the field of machine translation, where notable early successes were achieved in the 1990s due to work at IBM Research, such as their alignment models. This approach has since become increasingly popular, with advancements in deep learning algorithms further enhancing its capabilities.

The continued evolution of computational power and the availability of vast amounts of text data will undoubtedly continue to drive innovation in this field. In fact, Philip Resnik's ""Four Revolutions"" article on Language Log highlights four major revolutions that have transformed NLP: statistical learning, deep learning, neural machine translation, and sequence-to-sequence models. Richard Socher's Deep Learning for NLP tutorial at the ACL 2012 also marked a significant milestone in this evolution, as it introduced neural networks to the NLP community and sparked both interest and skepticism among participants.

Today, machine learning-powered NLP applications are widely used in various industries, from customer service and content moderation to legal document review and medical diagnosis. The impact of machine learning on NLP has been significant, as it has enabled machines to better understand and process human language, making it a crucial technology for many real-world applications.",0.9130434782608695,0.8267016753373223
