user_input,retrieved_contexts,response,faithfulness,answer_relevancy
O que é o reconhecimento de entidade nomeada (NER)?,"['de entrada. No entanto, os sistemas baseados em regras escritas à mão só podem ser tornados mais precisos aumentando a complexidade das regras, o que é uma tarefa muito mais difícil. Em particular, há um limite para a complexidade de sistemas baseados em regras artesanais, para além dos quais os sistemas se tornam cada vez mais incontroláveis. No entanto, a criação de mais dados para entrada em sistemas de aprendizado de máquina requer simplesmente um aumento correspondente no número de horas trabalhadas', '(por exemplo, contendo palavras ou estruturas que não foram vistas antes) e a entradas errôneas (por exemplo, com palavras ou palavras incorretamente omitidas). Geralmente, lidar com essas entradas de forma com regras manuscritas ou sistemas de regras manuscritas que tomam decisões suaves é extremamente trabalhoso, propenso a erros e demorado.\n\nSistemas baseados em aprender automaticamente as regras podem ser mais precisos simplesmente fornecendo mais dados de entrada. No entanto, os sistemas baseados em', 'individuais) que foram anotados à mão com os valores corretos a serem aprendidos.\n\nMuitas classes diferentes de algoritmos de aprendizado de máquina foram aplicadas a tarefas de PLN. Esses algoritmos tomam como entrada um grande conjunto de ""recursos"" que são gerados a partir de dados de entrada.\n\nAlguns dos algoritmos mais usados, como árvores de decisão, produziam sistemas de regras rígidas semelhantes aos sistemas de regras manuscritas mais comuns. No entanto, cada vez mais, a pesquisa tem se concentrado']","Based on the additional context provided, we can further explain that Named Entity Recognition (NER) is a technique used in Natural Language Processing (NLP) to identify and classify named entities mentioned in text. This involves recognizing and categorizing entities such as persons, organizations, locations, and dates, among others. The goal of NER is to extract structured information from unstructured text, which can then be used for various applications such as information extraction, question answering, and knowledge base population.

In the context provided, we see that NER algorithms are applied to tasks in Programming by Logic and Knowledge (PLN), which involves using machine learning techniques to automatically learn rules from large amounts of data. These algorithms take as input a large set of ""resources"" generated from input data. While some of the commonly used algorithms, such as decision trees, produce rigid rule systems similar to manually created rule-based systems, recent research has focused more on

Overall, NER is an important technique in NLP that allows for the extraction of structured information from unstructured text, which can be useful in a variety of applications. Its use in PLN demonstrates its versatility and potential for further advancements in machine learning and knowledge representation.",1.0,0.27691441807541833
O que distingue avaliação intrínseca de avaliação extrínseca em PLN?,"['intrínseca vs. extrínseca\n\nA avaliação intrínseca considera um sistema PNL isolado e caracteriza seu desempenho em relação a um resultado padrão-excelência, conforme definido pelos avaliadores. A avaliação extrínseca, também chamada de avaliação em uso, considera o sistema PLN em um cenário mais complexo como um sistema embutido ou uma função precisa para um usuário humano. O desempenho extrínseco do sistema é então caracterizado em termos de utilidade em relação à tarefa global do sistema estranho ou do', 'de análise.\n\nCaixa preta vs. Avaliação da caixa de vidro\n\nA avaliação em caixa preta requer que alguém execute um sistema PLN em um conjunto de dados de amostra e para medir uma série de parâmetros relacionados com a qualidade do processo, como velocidade, confiabilidade, consumo de recursos e, principalmente, a qualidade do resultado, como a precisão da anotação de dados ou a fidelidade de uma tradução. A avaliação da caixa de vidro examina a concepção do sistema; Os algoritmos que são implementados, os', 'avaliação em larga escala dos analisadores de dependência foi realizada no contexto das tarefas compartilhadas do CoNLL em 2006 e 2007.\n\nNa França, no âmbito do projecto ANR-Passage (final de 2007), foram comparados 10 analisadores para o francês.\n\nEm Itália, a campanha EVALITA foi realizada em 2007,[13] 2009, 2011 e 2014[14] para comparar várias ferramentas de PLN e de voz para o site italiano - EVALITA.\n\nDiferentes tipos de avaliação\n\n[editar | editar código-fonte]\n\nAvaliação intrínseca vs. extrínseca\n\nA']","The main difference between intrinsic evaluation and extrinsic evaluation in PLN (Planning at the Logic Level) is primarily the focus of the evaluation. Intrinsic evaluation focuses on the performance of the isolated PLN system and compares it to a predefined standard of excellence defined by the evaluators, while extrinsic evaluation considers the PLN system in a more complex scenario, such as an embedded system or a specific function for a human user. The primary difference between these two is that intrinsic evaluation focuses on the performance of the system itself, whereas extrinsic evaluation focuses on the utility of the system in relation to the overall task of the foreign system or the human user.

An analogy to better understand this distinction is that of black-box vs. glass-box testing. Intrinsic evaluation requires executing a PLN system with a set of randomly and independently selected samples, while extrinsic evaluation selects samples based on the specific task that the PLN system is being used for.

In summary, intrinsic evaluation focuses on the performance of the system itself, whereas extrinsic evaluation focuses on the utility of the system in relation to the overall task of the foreign system or the human user. Both evaluations are important for ensuring the performance and quality of the PLN system, but they should be used in a complementary manner to obtain more complete and reliable results.

In response to the new context provided, we can refine the original answer by providing examples of intrinsic and extrinsic evaluation in different countries and languages. For instance, in France, as part of the ANR-Passage project (2007), 10 dependency analyzers were compared for the French language. In Italy, the EVALITA campaign was conducted in 2007, 2009, 2011, and 2014 to compare various PLN and speech tools on the Italian website - EVALITA. These examples illustrate the importance of intrinsic and extrinsic evaluation for different languages and countries.",0.9473684210526315,0.35723754224519566
Quais são duas vantagens de sistemas de PLN baseados em aprendizagem de máquina em relação aos sistemas baseados em regras?,"['individuais) que foram anotados à mão com os valores corretos a serem aprendidos.\n\nMuitas classes diferentes de algoritmos de aprendizado de máquina foram aplicadas a tarefas de PLN. Esses algoritmos tomam como entrada um grande conjunto de ""recursos"" que são gerados a partir de dados de entrada.\n\nAlguns dos algoritmos mais usados, como árvores de decisão, produziam sistemas de regras rígidas semelhantes aos sistemas de regras manuscritas mais comuns. No entanto, cada vez mais, a pesquisa tem se concentrado', 'de entrada. No entanto, os sistemas baseados em regras escritas à mão só podem ser tornados mais precisos aumentando a complexidade das regras, o que é uma tarefa muito mais difícil. Em particular, há um limite para a complexidade de sistemas baseados em regras artesanais, para além dos quais os sistemas se tornam cada vez mais incontroláveis. No entanto, a criação de mais dados para entrada em sistemas de aprendizado de máquina requer simplesmente um aumento correspondente no número de horas trabalhadas', 'mecânica têm muitas vantagens em relação às regras produzidas manualmente:\n\nOs procedimentos de aprendizagem usados durante a aprendizagem da máquina focam-se automaticamente nos casos mais comuns, ao passo que quando se escrevem regras à mão, não é óbvio em que sentido o esforço deve ser dirigido.\n\nOs procedimentos de aprendizagem automática podem fazer uso de algoritmos de inferência estatística para produzir modelos que são robustos a entradas não familiares (por exemplo, contendo palavras ou estruturas']","Based on the additional context provided, we can further explain the two advantages of machine learning-based PLN systems over rule-based ones.

Firstly, machine learning-based PLN systems have the ability to learn automatically from large volumes of data without the need for specific rules to be programmed manually. This is because these systems use automated learning procedures that focus on common cases during training, whereas when rules are written by hand, it is not immediately clear in which direction the effort should be directed. As a result, machine learning-based systems are more adaptable to new situations and data, while rule-based systems are limited by the quantity and complexity of predefined rules.

Secondly, machine learning-based PLN systems tend to produce more accurate and reliable results than rule-based ones, particularly for complex tasks with many attributes or variables. This is because these systems can identify complex interactions between data and apply them to predict future outcomes, whereas rule-based systems are limited by the rigidity of predefined rules. However, increasing the complexity of rules in rule-based systems requires a much more difficult task, which has a limit beyond which the system becomes unmanageable. In contrast, adding more input data to machine learning-based PLN systems simply requires an increase in the number of hours worked.

In summary, machine learning-based PLN systems offer two key advantages over rule-based ones: their ability to learn automatically and their superior performance for complex tasks with many attributes or variables. Additionally, the new context highlights how automated learning procedures can focus on common cases during training, making these systems more adaptable to new situations and data.",0.7142857142857143,0.2521407856098392
