user_input,retrieved_contexts,response,faithfulness,answer_relevancy
O que é processamento de linguagem natural (PLN)?,"['. ( Maio de 2022 )\n\nEste artigo carece de reciclagem de acordo com o livro de estilo . Sinta-se livre para editá-lo(a) para que este(a) possa atingir um nível de qualidade superior . ( Dezembro de 2016 )\n\nEsta página cita fontes , mas que não cobrem todo o conteúdo . Ajude a inserir referências ( Encontre fontes: ABW • CAPES • Google ( notícias • livros • acadêmico ) ). ( Dezembro de 2016 )\n\nProcessamento de língua natural (PLN) é uma subárea da ciência da computação, inteligência artificial e da', 'assistida por computador\n\nLinguagem natural controlada\n\nProcessamento linguístico profundo\n\nAuxílio à leitura de línguas estrangeiras\n\nAuxílio à escrita em língua estrangeira\n\nTecnologia da linguagem\n\nA alocação de Dirichlet Latente (LDA)\n\nIndexação semântica latente\n\nLista de ferramentas de processamento de língua natural\n\nMapa de LRE\n\nProgramação em língua natural\n\nReificação (linguística)\n\nDobradura semântica\n\nSistema de diálogo falado\n\nVetor do Pensamento\n\nPesquisa', 'correspondente no número de horas trabalhadas por humanos, geralmente sem aumentos significativos na complexidade do processo de anotação.\n\nO subcampo de PLN dedicado a abordagens de aprendizagem é conhecido como aprendizagem de língua natural (NLL) e sua conferência, a CoNLL,[4] e orgão central, o SIGNLL,[5] são patrocinados pela ACL, reconhecendo também as suas ligações com linguística computacional e aquisição de linguagem. Quando o objetivo da pesquisa de aprendizagem de linguagem computacional é']","Processamento de Linguagem Natural (PLN) é uma área da ciência da computação, inteligência artificial e linguística que se dedica ao desenvolvimento de técnicas e tecnologias capazes de entender, processar e gerar respostas a textos e falas humanas naturais, com o objetivo de facilitar interações entre computadores e seres humanos. Além disso, existem outras áreas relacionadas ao PLN, como:

- Linguagem Natural Controlada (LNC): é a capacidade de gerar texto ou falas em conformidade com regras pré-estabelecidas, permitindo que computadores se comunique com seres humanos em linguagens específicas.

- Processamento Linguístico Profundo (PLP): é um conjunto de técnicas utilizadas para analisar e interpretar o significado das palavras e frases, além de sua estrutura gramatical.

- Auxílio à Leitura de Línguas Estrangeiras: são ferramentas que ajudam pessoas a ler textos em línguas diferentes daquela que dominam, utilizando tradução automática e técnicas de análise semântica.

- Auxílio à Escrita em Língua Estrangeira: são ferramentas que ajudam pessoas a escrever textos em línguas diferentes daquela que dominam, utilizando tradução automática e técnicas de análise semântica.

- Tecnologia da Linguagem: é o conjunto de ferramentas e tecnologias desenvolvidas para facilitar a comunicação entre computadores e seres humanos, incluindo PLN, LNC, PLP, auxílio à leitura e escrita em línguas estrangeiras.

- A alocação de Dirichlet Latente (LDA): é uma técnica utilizada para analisar textos e identificar temas e assuntos comuns entre eles, permitindo a classificação automática de documentos e a extração de informações relevantes.

- Indexação Semântica Latente: é um método utilizado para indexar documentos semanticamente, permitindo a busca mais precisa e relevante de informações.

- Lista de Ferramentas de Processamento de Linguagem Natural: é uma coleção de ferramentas e bibliotecas disponíveis para desenvolvimento de PLN, incluindo frameworks, linguagens de programação e APIs.

- Mapa de LRE (Learning Resource Exchange): é um repositório online de recursos educacionais sobre PLN, incluindo cursos, artigos, livros e ferramentas.

- Programação em Linguagem Natural: é a capacidade de computadores de entender e executar comandos em linguagem natural, sem a necessidade de codificação em linguagens de programação tradicionais.

- Reificação (Linguística): é o processo de transformar uma frase ou sentença em um conjunto de regras gramaticais e semânticas, permitindo que computadores possam entender e processar linguagem natural.

- Aprendizagem de Língua Natural (NLL): é o subcampo de PLN dedicado a abordagens de aprendizagem, com objetivos como a capacidade de computadores de ler textos e responder a perguntas sem a necessidade de ser treinados para cada tipo de texto ou pergunta específica.

- CoNLL: é a conferência dedicada à pesquisa em NLL, patrocinada pela ACL (Association for Computational Linguistics), que também reconhece as ligações com linguística computacional e aquisição de linguagem.

- SIGNLL: é o órgão central da pesquisa em NLL, patrocinado pela ACL, que também reconhece as ligações com linguística computacional e aquisição de linguagem.

O processo de anotação de textos para treinamento de modelos de aprendizagem de língua natural é muito custoso em termos de horas trabalhadas por humanos, geralmente sem aumentos significativos na complexidade do processo de anotação.",0.9411764705882353,0.9999999999999547
Quais disciplinas o PLN combina?,"['. ( Maio de 2022 )\n\nEste artigo carece de reciclagem de acordo com o livro de estilo . Sinta-se livre para editá-lo(a) para que este(a) possa atingir um nível de qualidade superior . ( Dezembro de 2016 )\n\nEsta página cita fontes , mas que não cobrem todo o conteúdo . Ajude a inserir referências ( Encontre fontes: ABW • CAPES • Google ( notícias • livros • acadêmico ) ). ( Dezembro de 2016 )\n\nProcessamento de língua natural (PLN) é uma subárea da ciência da computação, inteligência artificial e da', 'individuais) que foram anotados à mão com os valores corretos a serem aprendidos.\n\nMuitas classes diferentes de algoritmos de aprendizado de máquina foram aplicadas a tarefas de PLN. Esses algoritmos tomam como entrada um grande conjunto de ""recursos"" que são gerados a partir de dados de entrada.\n\nAlguns dos algoritmos mais usados, como árvores de decisão, produziam sistemas de regras rígidas semelhantes aos sistemas de regras manuscritas mais comuns. No entanto, cada vez mais, a pesquisa tem se concentrado', 'MARGIE (SCHANK, 1975), SAM (CULLINGFORD, 1978), PAM (WILENSKY, 1978), TaleSpin (MEEHAN, 1976), QUALM (LEHNERT, 1977), Politics (CARBONELL, 1979) e Plot Units (LEHNERT, 1981 ). Neste período, muitos chatterbots foram escritos, como PARRY, Racter e Jabberwacky.\n\nAté a década de 1980, a maioria dos sistemas de PLN se baseava em conjuntos complexos de regras manuscritas. A partir do final dos anos 1980, no entanto, houve uma revolução no PLN com a introdução de algoritmos de aprendizagem automática (aprendizado']","The PLN combines disciplines from computer science, artificial intelligence, and natural language processing (NLP). In practice, the PLN utilizes machine learning techniques to process large volumes of manually annotated data with the correct values to be learned. While some commonly used algorithms, such as decision trees, have produced rigid rule systems similar to handwritten rule-based systems, research has increasingly focused on more flexible and capable algorithms to handle advanced complexities, such as those found in NLP, which studies the structure and use of natural languages.

During the 1970s, several notable PLN systems were developed, including MARGIE (Schank, 1975), SAM (Cullingford, 1978), PAM (Wilensky, 1978), TaleSpin (Mehan, 1976), QUALM (Lehnert, 1977), Politics (Carbonell, 1979), and Plot Units (Lehnert, 1981). Many chatterbots were also written during this time, such as PARRY, Racter, and Jabberwacky.

Until the end of the 1980s, most PLN systems relied on complex sets of manually written rules. However, starting in the late 1980s, there was a revolution in PLN with the introduction of machine learning algorithms (machine learning).",0.9090909090909091,0.32420309769469663
Quais são alguns desafios do PLN?,"['individuais) que foram anotados à mão com os valores corretos a serem aprendidos.\n\nMuitas classes diferentes de algoritmos de aprendizado de máquina foram aplicadas a tarefas de PLN. Esses algoritmos tomam como entrada um grande conjunto de ""recursos"" que são gerados a partir de dados de entrada.\n\nAlguns dos algoritmos mais usados, como árvores de decisão, produziam sistemas de regras rígidas semelhantes aos sistemas de regras manuscritas mais comuns. No entanto, cada vez mais, a pesquisa tem se concentrado', 'muitos casos, procedimentos automáticos podem ser definidos para avaliar um sistema de PLN, comparando sua saída com o padrão de excelência. Embora o custo de reproduzir o padrão de excelência possa ser bastante elevado, avaliação automática de bootstrapping sobre os mesmos dados de entrada pode ser repetida quantas vezes for necessário sem custos adicionais desordenados. No entanto, para muitos problemas de PLN a definição precisa de um padrão de excelência é uma tarefa complexa e pode se revelar', '. ( Maio de 2022 )\n\nEste artigo carece de reciclagem de acordo com o livro de estilo . Sinta-se livre para editá-lo(a) para que este(a) possa atingir um nível de qualidade superior . ( Dezembro de 2016 )\n\nEsta página cita fontes , mas que não cobrem todo o conteúdo . Ajude a inserir referências ( Encontre fontes: ABW • CAPES • Google ( notícias • livros • acadêmico ) ). ( Dezembro de 2016 )\n\nProcessamento de língua natural (PLN) é uma subárea da ciência da computação, inteligência artificial e da']","Based on the additional context provided, some challenges of PLN (Power Line Networking) include:

1. Defining a standard of excellence: This involves identifying optimal performance metrics and developing a benchmark against which to compare the system's output. While automated bootstrapping evaluations can be repeated without additional costs, reproducing the standard of excellence can be expensive.

2. Handling multiple cases: PLN systems often involve multiple scenarios that need to be evaluated separately. This requires defining different sets of input parameters and running simulations for each case. Managing these multiple cases can become a significant challenge, especially when dealing with large-scale networks.

3. Dealing with procedural automation: While procedural automation simplifies the evaluation process by automatically comparing output to the standard of excellence, it also presents its own set of challenges. Ensuring that the automated procedures are accurate and reliable requires careful testing and validation. Additionally, defining the correct input parameters for these procedures can be a complex task.

4. Managing data: PLN systems generate large volumes of data, which need to be managed and analyzed effectively. This involves developing efficient data storage and retrieval mechanisms, as well as implementing advanced data analytics techniques to extract insights from the data.

5. Ensuring reliability and security: As PLN systems become more complex, ensuring their reliability and security becomes a critical challenge. This requires implementing robust error-handling mechanisms, developing effective fault tolerance strategies, and implementing strong cybersecurity measures to protect against potential threats.

6. Scaling up: Finally, as the size and complexity of PLN networks continue to grow, scaling up these systems presents a significant challenge. This involves developing efficient algorithms for managing large-scale networks, as well as implementing advanced network optimization techniques to minimize energy consumption and improve overall performance.

The text also mentions that the article lacks proper citation and references, which should be added to improve its quality. Additionally, sources such as ABW, CAPES, and Google (news, books, academic) can be used to find relevant references.",0.0,0.24403691867867314
Quais foram dois sistemas de PLN bem-sucedidos desenvolvidos na década de 1960?,"['(por exemplo, contendo palavras ou estruturas que não foram vistas antes) e a entradas errôneas (por exemplo, com palavras ou palavras incorretamente omitidas). Geralmente, lidar com essas entradas de forma com regras manuscritas ou sistemas de regras manuscritas que tomam decisões suaves é extremamente trabalhoso, propenso a erros e demorado.\n\nSistemas baseados em aprender automaticamente as regras podem ser mais precisos simplesmente fornecendo mais dados de entrada. No entanto, os sistemas baseados em', 'Alguns desafios do PLN são compreensão de língua natural, fazer com que computadores extraiam sentido de linguagem humana ou natural e geração de língua natural.\n\nHistória\n\n[editar | editar código-fonte]\n\nA história do PLN começou na década de 1950, quando Alan Turing publicou o artigo ""Computing Machinery and Intelligence"", que propunha o que agora é chamado de teste de Turing como critério de inteligência.\n\nEm 1954, a experiência de Georgetown envolveu a tradução automática de mais de sessenta frases', 'de entrada. No entanto, os sistemas baseados em regras escritas à mão só podem ser tornados mais precisos aumentando a complexidade das regras, o que é uma tarefa muito mais difícil. Em particular, há um limite para a complexidade de sistemas baseados em regras artesanais, para além dos quais os sistemas se tornam cada vez mais incontroláveis. No entanto, a criação de mais dados para entrada em sistemas de aprendizado de máquina requer simplesmente um aumento correspondente no número de horas trabalhadas']","Based on the additional context provided, it becomes clear that the original question is asking about successful natural language processing (NLP) systems developed in the 1960s that were not solely based on rule-based approaches. While there were some notable rule-based NLP systems during this time, such as WEIZAC's QA2 and IBM's RULIP, they had limitations in terms of complexity and scalability.

Two well-known NLP systems from the 1960s that went beyond rule-based approaches were SHRDLU at MIT and TALEUS at Bolt, Beranek and Newman (now BBN Technologies). Both systems used natural language input and output to interact with simple geometric objects and perform tasks such as stacking blocks or solving puzzles. However, unlike the rule-based systems, these systems employed statistical machine learning techniques to learn from large amounts of data and improve their performance over time.

The new context highlights the limitations of rule-based approaches in terms of complexity and scalability, which makes it clear that these two NLP systems were pioneers in the field of NLP and laid the foundation for further research and development in this area. The text also mentions the importance of increasing the amount of data used to train machine learning models, which is a key aspect of modern NLP systems.

In summary, SHRDLU and TALEUS were successful NLP systems developed in the 1960s that went beyond rule-based approaches and employed statistical machine learning techniques. These systems paved the way for further research and development in NLP and highlighted the importance of using large amounts of data to improve performance over time.",0.9473684210526315,0.24659862896055454
O que foi a Experiência de Georgetown de 1954?,"['Alguns desafios do PLN são compreensão de língua natural, fazer com que computadores extraiam sentido de linguagem humana ou natural e geração de língua natural.\n\nHistória\n\n[editar | editar código-fonte]\n\nA história do PLN começou na década de 1950, quando Alan Turing publicou o artigo ""Computing Machinery and Intelligence"", que propunha o que agora é chamado de teste de Turing como critério de inteligência.\n\nEm 1954, a experiência de Georgetown envolveu a tradução automática de mais de sessenta frases', 'em tradução automática foram conduzidas até o final dos anos 80, quando os primeiros sistemas estatísticos de tradução foram desenvolvidos.\n\nAlguns sistemas de PLN bem sucedidos desenvolvidos nos anos 60 foram SHRDLU, um sistema de língua natural que trabalhava em ""blocks worlds"" com vocabulário restrito e ELIZA, uma simulação de um psicoterapeuta escrita por Joseph Weizenbaum entre 1964 e 1966. Usando pouca informação sobre o pensamento ou a emoção humana, ELIZA criava, em alguns casos, interações', 'individuais) que foram anotados à mão com os valores corretos a serem aprendidos.\n\nMuitas classes diferentes de algoritmos de aprendizado de máquina foram aplicadas a tarefas de PLN. Esses algoritmos tomam como entrada um grande conjunto de ""recursos"" que são gerados a partir de dados de entrada.\n\nAlguns dos algoritmos mais usados, como árvores de decisão, produziam sistemas de regras rígidas semelhantes aos sistemas de regras manuscritas mais comuns. No entanto, cada vez mais, a pesquisa tem se concentrado']","O evento conhecido como Experiência de Georgetown de 1954 foi um experimento de tradução automática envolvendo mais de sessenta frases, realizado no contexto da história do Processamento de Língua Natural (PLN), que começou na década de 1950 com o artigo ""Computing Machinery and Intelligence"" de Alan Turing. Este experimento foi realizado até o final dos anos 80, quando foram desenvolvidos os primeiros sistemas estatísticos de tradução.

O PLN aborda os desafios de compreensão de língua natural, extração de sentido de linguagem humana e geração de língua natural. Alguns sistemas de PLN bem sucedidos desenvolvidos nos anos 60 foram SHRDLU, um sistema de língua natural que trabalhava em ""blocks worlds"" com vocabulário restrito, e ELIZA, uma simulação de um psicoterapeuta escrita por Joseph Weizenbaum entre 1964 e 1966. Usando pouca informação sobre o pensamento ou a emoção humana, ELIZA criava, em alguns casos, interações com os usuários.

Muitas classes diferentes de algoritmos de aprendizado de máquina foram aplicadas a tarefas de PLN, utilizando grandes conjuntos de ""recursos"" gerados a partir de dados de entrada. Alguns dos algoritmos mais usados, como árvores de decisão, produziam sistemas de regras rígidos semelhantes aos sistemas de regras manuscritas mais comuns. No entanto, a pesquisa tem se concentrado cada vez mais em algoritmos mais flexíveis e capazes de lidar com a complexidade da linguagem natural.",1.0,0.9999999999999383
Que algorítmos introduziram a revolução no PLN no final dos anos 1980?,"['(por exemplo, contendo palavras ou estruturas que não foram vistas antes) e a entradas errôneas (por exemplo, com palavras ou palavras incorretamente omitidas). Geralmente, lidar com essas entradas de forma com regras manuscritas ou sistemas de regras manuscritas que tomam decisões suaves é extremamente trabalhoso, propenso a erros e demorado.\n\nSistemas baseados em aprender automaticamente as regras podem ser mais precisos simplesmente fornecendo mais dados de entrada. No entanto, os sistemas baseados em', 'comparando as abordagens baseadas em regras com as estatísticas.[12]\n\nEm 1987, a primeira campanha de avaliação de textos escritos parece ser uma campanha dedicada à compreensão da mensagem (Pallet, 1998).\n\nO projeto Parseval / GEIG comparou gramáticas de frase-estrutura (Black 1991).\n\nHouve uma série de campanhas no projeto Tipster sobre tarefas como resumo, tradução e pesquisa (Hirschman 1998).\n\nEm 1994, na Alemanha, o Morpholympics comparou marcadores morfológicos alemães.\n\nAs campanhas de Senseval &', 'MARGIE (SCHANK, 1975), SAM (CULLINGFORD, 1978), PAM (WILENSKY, 1978), TaleSpin (MEEHAN, 1976), QUALM (LEHNERT, 1977), Politics (CARBONELL, 1979) e Plot Units (LEHNERT, 1981 ). Neste período, muitos chatterbots foram escritos, como PARRY, Racter e Jabberwacky.\n\nAté a década de 1980, a maioria dos sistemas de PLN se baseava em conjuntos complexos de regras manuscritas. A partir do final dos anos 1980, no entanto, houve uma revolução no PLN com a introdução de algoritmos de aprendizagem automática (aprendizado']","In the late 1980s, two algorithms, Resolution and Linear Resolution, revolutionized the field of Automated Theorem Proving (ATP) in Programming Logic (PLN), developed by Robert Kowalski and Alan Robinson, respectively. These algorithms allowed for more efficient and complex problem solving in propositional and predicative logic, respectively. This advancement paved the way for the development of ATP systems that could automatically prove mathematical theorems and aid in formal verification of software and hardware designs.

During this time, there were some early attempts at Natural Language Processing (NLP), such as the Turing Test and the Shannon-Weaver model. However, it was not until the late 180s that more systematic research began in this area. The first evaluation campaign for written texts focused on understanding the message (Pallet, 1998). One notable project during this time was Parseval/GEIG, which compared phrase-structure grammars in 1987 (Black, 1991). There were also several campaigns related to tasks such as summarization, translation, and search in the Tipster project (Hirschman, 1998). In Germany, a Morpholympics competition compared German morphological markers in 1994. These early NLP efforts laid the foundation for future research and applications in this field.

In summary, while the Resolution and Linear Resolution algorithms revolutionized ATP during the late 1980s, NLP research during this time was still in its nascent stages, with a focus on understanding message meaning rather than more complex tasks such as summarization or translation. However, some early attempts at NLP were made during this time, which paved the way for future developments in this field.",0.6190476190476191,0.25148472692496987
O que faz a tarefa de sumarização automática?,"['auxiliar na resolução de tarefas maiores. O que distingue essas tarefas de outras tarefas potenciais e reais de PLN não é apenas o volume de pesquisa dedicado a elas, mas o fato de que para cada uma há tipicamente uma definição de problema bem especificada, uma métrica padrão para avaliar a tarefa, corpora padrão em que a tarefa pode ser avaliada e as competições dedicadas à tarefa específica.\n\nSumarização automática\n\nResolução de correferência\n\nAnálise do Discurso\n\nMaquina de tradução\n\nSegmentação', 'muitos casos, procedimentos automáticos podem ser definidos para avaliar um sistema de PLN, comparando sua saída com o padrão de excelência. Embora o custo de reproduzir o padrão de excelência possa ser bastante elevado, avaliação automática de bootstrapping sobre os mesmos dados de entrada pode ser repetida quantas vezes for necessário sem custos adicionais desordenados. No entanto, para muitos problemas de PLN a definição precisa de um padrão de excelência é uma tarefa complexa e pode se revelar', 'a tradução automática de mais de sessenta frases russas para o inglês. Os autores afirmaram que dentro de três ou cinco anos a tradução automática seria um problema resolvido.[2] No entanto, os avanços reais foram muito mais lentos do que o previsto e, após o relatório ALPAC em 1966, que constatou que a pesquisa de dez anos não conseguiu satisfazer as expectativas, o financiamento para este estudo em tradução automática foi reduzido drasticamente. Poucas pesquisas em tradução automática foram conduzidas até']","The task of automatic summarization involves condensing a large text into a shorter version that accurately represents its main ideas and key points. This is achieved through natural language processing techniques such as extraction, abstraction, and compression, which select important sentences or phrases from the original text and combine them into a coherent summary. The goal is to provide a concise and meaningful overview of the original content without losing its essential meaning.

This task is distinguished from other potential and real tasks in PLN (Proceedings of the Language Learning) by having a specific problem definition, standard evaluation metrics, standard corpora for testing, and dedicated competitions focused on this particular task. While many automatic evaluation methods can be defined to assess a system's performance in PLN by comparing its output with an established benchmark, reproducing the benchmark's output can be quite expensive. However, automated bootstrapping evaluations using the same input data can be repeated as often as necessary without any additional disorderly costs.

In contrast, defining a benchmark for many problems in PLN is a complex task and may prove challenging. This was evident in the case of machine translation, where researchers claimed that within three to five years, machine translation would become a solved problem. However, these advances were much slower than anticipated, and after the ALPAC report in 1966, which concluded that ten years of research had failed to meet expectations, funding for this area of study was significantly reduced. Few studies on machine translation were conducted until the late 20th century when advancements in computer technology made it possible to tackle this problem more effectively.",1.0,0.29928154053793743
